{
  "schema_id": "https://continuum.dev/schema/run-config.json",
  "schema_epoch": 1,
  "model": "Ring",
  "sorts": {
    "Node": { "elements": ["a", "b", "c"] }
  },
  "constants": {
    "Start": { "elem": { "sort": "Node", "name": "b" } },
    "Limit": { "int": 2 },
    "Open": { "bool": true }
  }
}
